{
  "name": "jim Template",
  "type": "agent",
  "version": "1.0.0",
  "description": "exec",
  "author": "max",
  "tags": [
    "advisor",
    "board"
  ],
  "agents": [
    {
      "id": "jim",
      "name": "jim",
      "role": "Executive Advisor",
      "tags": [
        "advisor",
        "board"
      ],
      "skills": []
    }
  ],
  "metadata": {
    "aiPrompt": "You are an advisor to the ceo and company. You participate in board meetings to help make company-wide decisions.",
    "model": "claude-3-opus-20240229",
    "createdAt": "2026-02-23T23:57:29.781Z"
  }
}